{
  "$schema": "https://json-schema.org/draft/2020-12/schema",
  "$id": "https://github.com/donovan-yohan/belayer/docs/artifact-schemas/org-plan.schema.json",
  "title": "Belayer Organization Plan",
  "type": "object",
  "additionalProperties": false,
  "required": ["schema_version", "objective", "lead", "tasks", "gates"],
  "properties": {
    "schema_version": {
      "const": "belayer-org-plan/v1"
    },
    "objective": {
      "type": "string",
      "minLength": 1
    },
    "lead": {
      "type": "string",
      "minLength": 1
    },
    "context_artifacts": {
      "type": "array",
      "items": {
        "type": "string",
        "minLength": 1
      },
      "default": []
    },
    "tasks": {
      "type": "array",
      "minItems": 1,
      "items": {
        "$ref": "#/$defs/task"
      }
    },
    "assignments": {
      "type": "array",
      "items": {
        "$ref": "#/$defs/assignment"
      },
      "default": []
    },
    "gates": {
      "type": "array",
      "items": {
        "$ref": "#/$defs/gate"
      }
    },
    "risks": {
      "type": "array",
      "items": {
        "type": "string",
        "minLength": 1
      },
      "default": []
    },
    "created_at": {
      "type": "string",
      "format": "date-time"
    }
  },
  "$defs": {
    "task": {
      "type": "object",
      "additionalProperties": false,
      "required": ["id", "title", "owner", "status", "acceptance"],
      "properties": {
        "id": {
          "type": "string",
          "minLength": 1
        },
        "parent": {
          "type": "string"
        },
        "title": {
          "type": "string",
          "minLength": 1
        },
        "owner": {
          "type": "string",
          "minLength": 1
        },
        "status": {
          "enum": ["planned", "ready", "running", "active", "blocked", "review", "done", "passed", "failed"]
        },
        "dependencies": {
          "type": "array",
          "items": {
            "type": "string",
            "minLength": 1
          },
          "default": []
        },
        "acceptance": {
          "type": "array",
          "minItems": 1,
          "items": {
            "type": "string",
            "minLength": 1
          }
        },
        "expected_outputs": {
          "type": "array",
          "items": {
            "type": "string",
            "minLength": 1
          },
          "default": []
        },
        "gates": {
          "type": "array",
          "items": {
            "type": "string",
            "minLength": 1
          },
          "default": []
        },
        "attempts": {
          "type": "object",
          "additionalProperties": false,
          "properties": {
            "max": {
              "type": "integer",
              "minimum": 1
            },
            "used": {
              "type": "integer",
              "minimum": 0
            }
          }
        },
        "output_artifacts": {
          "type": "array",
          "items": {
            "type": "string",
            "minLength": 1
          },
          "default": []
        }
      }
    },
    "assignment": {
      "type": "object",
      "additionalProperties": false,
      "required": ["talent", "source", "reason", "activation", "runtime", "contract"],
      "properties": {
        "talent": {
          "type": "string",
          "minLength": 1
        },
        "source": {
          "enum": ["project", "crag", "catalog", "generated"]
        },
        "reason": {
          "type": "string",
          "minLength": 1
        },
        "activation": {
          "$ref": "#/$defs/activation"
        },
        "runtime": {
          "$ref": "#/$defs/runtime"
        },
        "contract": {
          "$ref": "#/$defs/talent_contract"
        },
        "task_ids": {
          "type": "array",
          "items": {
            "type": "string",
            "minLength": 1
          },
          "default": []
        }
      }
    },
    "activation": {
      "type": "object",
      "additionalProperties": false,
      "required": ["mode"],
      "properties": {
        "mode": {
          "enum": ["climb_start", "on_demand", "gate_triggered", "generated"]
        },
        "triggers": {
          "type": "array",
          "items": {
            "type": "string",
            "minLength": 1
          },
          "default": []
        }
      }
    },
    "runtime": {
      "type": "object",
      "additionalProperties": false,
      "required": ["lifecycle"],
      "properties": {
        "lifecycle": {
          "enum": ["resident", "resumable", "ephemeral"]
        },
        "idle_after": {
          "enum": ["task_done", "gate_result_submitted", "session_complete", "manual"]
        },
        "resume": {
          "enum": ["hermes_session", "none"]
        }
      }
    },
    "talent_contract": {
      "type": "object",
      "additionalProperties": false,
      "required": ["accepts", "produces"],
      "properties": {
        "accepts": {
          "type": "array",
          "minItems": 1,
          "items": {
            "type": "string",
            "minLength": 1
          }
        },
        "produces": {
          "type": "array",
          "minItems": 1,
          "items": {
            "type": "string",
            "minLength": 1
          }
        },
        "requires": {
          "type": "array",
          "items": {
            "type": "string",
            "minLength": 1
          },
          "default": []
        }
      }
    },
    "gate": {
      "type": "object",
      "additionalProperties": false,
      "required": ["id", "stage", "authority", "assigned_talent", "verdicts"],
      "properties": {
        "id": {
          "type": "string",
          "minLength": 1
        },
        "stage": {
          "enum": ["task", "phase", "session"]
        },
        "authority": {
          "enum": ["advisory", "blocking", "human-escalation"]
        },
        "input_artifacts": {
          "type": "array",
          "items": {
            "type": "string",
            "minLength": 1
          },
          "default": []
        },
        "output_artifact": {
          "type": "string",
          "default": "gate-result"
        },
        "assigned_talent": {
          "type": "array",
          "minItems": 1,
          "items": {
            "type": "string",
            "minLength": 1
          }
        },
        "verdicts": {
          "type": "array",
          "minItems": 1,
          "items": {
            "enum": ["pass", "pass-with-notes", "fail", "blocked"]
          }
        }
      }
    }
  }
}
